<!ELEMENT books (book+)>
<!ELEMENT book (title, author, isbn, publisher, edition, price)>
<!ELEMENT title (#PCDATA)>
<!ELEMENT author (first, middle?, last)>
<!ATTLIST author title (mr | mrs | ms) "ms">
<!ELEMENT first (#PCDATA)>
<!ELEMENT middle (#PCDATA)>
<!ELEMENT last (#PCDATA)>
<!ELEMENT isbn (#PCDATA)>
<!ELEMENT publisher (#PCDATA)>
<!ELEMENT edition (#PCDATA)>
<!ELEMENT price (#PCDATA)>