<?xml version="1.0" encoding="UTF-8"?>
<!DOCTYPE book SYSTEM "file:/C:/Users/user/Documents/XML/Q.no.1.dtd">
<book xmlns:xsi="http://www.w3.org/2001/XMLSchema-instance" xsi:noNamespaceSchemaLocation="file:/C:/Users/user/Documents/XML/Q.no.2.xsd">
<title>Web Technology</title>
<author>
    <first>Basanta</first>
    <last>Chapagain</last>
</author>
<isbn>123-1344</isbn>
<publisher>KEC</publisher>
<edition>2</edition>
<price>750</price>
</book>